{
  "schemaVersion": 1,
  "chartId": "silent-demo-001",
  "title": "Silent Demo 01 ",
  "audio": {
    "path": "",
    "chartZeroAtAudioSeconds": 0
  },
  "timing": {
    "initialBpm": 120
  },
  "notes": [
    {
      "id": "n001",
      "type": "DOUBLE",
      "beat": 0,
      "lane": 1,
      "width": 4,
      "durationBeats": 0
    },
    {
      "id": "n002",
      "type": "DOUBLE",
      "beat": 1,
      "lane": 1,
      "width": 4,
      "durationBeats": 0
    },
    {
      "id": "n003",
      "type": "TOUCH",
      "beat": 0.5,
      "lane": 4,
      "width": 4,
      "durationBeats": 0
    },
    {
      "id": "n004",
      "type": "TOUCH",
      "beat": 1.5,
      "lane": 4,
      "width": 4,
      "durationBeats": 0
    },
    {
      "id": "n005",
      "type": "TOUCH",
      "beat": 2.5,
      "lane": 4,
      "width": 4,
      "durationBeats": 0
    },
    {
      "id": "n006",
      "type": "TOUCH",
      "beat": 3.5,
      "lane": 4,
      "width": 4,
      "durationBeats": 0
    },
    {
      "id": "n007",
      "type": "TOUCH",
      "beat": 4.5,
      "lane": 4,
      "width": 4,
      "durationBeats": 0
    },
    {
      "id": "n008",
      "type": "TOUCH",
      "beat": 5.5,
      "lane": 4,
      "width": 4,
      "durationBeats": 0
    },
    {
      "id": "n009",
      "type": "TOUCH",
      "beat": 6.5,
      "lane": 4,
      "width": 4,
      "durationBeats": 0
    },
    {
      "id": "n010",
      "type": "TOUCH",
      "beat": 7.5,
      "lane": 4,
      "width": 4,
      "durationBeats": 0
    },
    {
      "id": "n011",
      "type": "DOUBLE",
      "beat": 2,
      "lane": 7,
      "width": 4,
      "durationBeats": 0
    },
    {
      "id": "n012",
      "type": "DOUBLE",
      "beat": 3,
      "lane": 7,
      "width": 4,
      "durationBeats": 0
    },
    {
      "id": "n013",
      "type": "DOUBLE",
      "beat": 4,
      "lane": 1,
      "width": 4,
      "durationBeats": 0
    },
    {
      "id": "n014",
      "type": "DOUBLE",
      "beat": 5,
      "lane": 1,
      "width": 4,
      "durationBeats": 0
    },
    {
      "id": "n016",
      "type": "DOUBLE",
      "beat": 6,
      "lane": 7,
      "width": 4,
      "durationBeats": 0
    },
    {
      "id": "n017",
      "type": "DOUBLE",
      "beat": 7,
      "lane": 7,
      "width": 4,
      "durationBeats": 0
    },
    {
      "id": "n015",
      "type": "DOUBLE",
      "beat": 8,
      "lane": 1,
      "width": 4,
      "durationBeats": 0
    },
    {
      "id": "n018",
      "type": "DOUBLE",
      "beat": 9,
      "lane": 1,
      "width": 4,
      "durationBeats": 0
    },
    {
      "id": "n019",
      "type": "TOUCH",
      "beat": 8.5,
      "lane": 4,
      "width": 4,
      "durationBeats": 0
    },
    {
      "id": "n020",
      "type": "TOUCH",
      "beat": 9.5,
      "lane": 4,
      "width": 4,
      "durationBeats": 0
    },
    {
      "id": "n021",
      "type": "TOUCH",
      "beat": 10.5,
      "lane": 4,
      "width": 4,
      "durationBeats": 0
    },
    {
      "id": "n022",
      "type": "TOUCH",
      "beat": 11.5,
      "lane": 4,
      "width": 4,
      "durationBeats": 0
    },
    {
      "id": "n023",
      "type": "TOUCH",
      "beat": 12.5,
      "lane": 4,
      "width": 4,
      "durationBeats": 0
    },
    {
      "id": "n024",
      "type": "TOUCH",
      "beat": 13.5,
      "lane": 4,
      "width": 4,
      "durationBeats": 0
    },
    {
      "id": "n025",
      "type": "TOUCH",
      "beat": 14.5,
      "lane": 4,
      "width": 4,
      "durationBeats": 0
    },
    {
      "id": "n026",
      "type": "TOUCH",
      "beat": 15.5,
      "lane": 4,
      "width": 4,
      "durationBeats": 0
    },
    {
      "id": "n027",
      "type": "DOUBLE",
      "beat": 10,
      "lane": 7,
      "width": 4,
      "durationBeats": 0
    },
    {
      "id": "n028",
      "type": "DOUBLE",
      "beat": 11,
      "lane": 7,
      "width": 4,
      "durationBeats": 0
    },
    {
      "id": "n029",
      "type": "DOUBLE",
      "beat": 12,
      "lane": 1,
      "width": 4,
      "durationBeats": 0
    },
    {
      "id": "n030",
      "type": "DOUBLE",
      "beat": 13,
      "lane": 1,
      "width": 4,
      "durationBeats": 0
    },
    {
      "id": "n031",
      "type": "DOUBLE",
      "beat": 14,
      "lane": 7,
      "width": 4,
      "durationBeats": 0
    },
    {
      "id": "n032",
      "type": "DOUBLE",
      "beat": 15,
      "lane": 7,
      "width": 4,
      "durationBeats": 0
    },
    {
      "id": "n034",
      "type": "DOUBLE",
      "beat": 16,
      "lane": 4,
      "width": 4,
      "durationBeats": 0
    }
  ],
  "events": [
    {
      "id": "e01",
      "beat": 4,
      "tag": "scroll.speed",
      "parameters": [
        {
          "name": "multiplier",
          "type": "number",
          "value": "1.5"
        }
      ]
    },
    {
      "id": "e02",
      "beat": 8,
      "tag": "scroll.speed",
      "parameters": [
        {
          "name": "multiplier",
          "type": "number",
          "value": "0.75"
        }
      ]
    },
    {
      "id": "e03",
      "beat": 12,
      "tag": "playback.stop",
      "parameters": [
        {
          "name": "durationSeconds",
          "type": "number",
          "value": "1.0"
        }
      ]
    },
    {
      "id": "e04",
      "beat": 16,
      "tag": "custom.example",
      "parameters": [
        {
          "name": "payload",
          "type": "json",
          "value": "{\"message\":\"future editor tag\",\"color\":\"cyan\"}"
        }
      ]
    }
  ]
}
